{
  "id": "indie-hacker",
  "name": "Indie Hacker",
  "description": "Optimizes repos to clearly communicate products and experiments to potential users, collaborators, and early adopters.",
  "audience": "Potential users, collaborators, and newsletter/readers coming from social or blogs.",
  "tone": "product",
  "targetPlatforms": ["saas", "cli-tool", "browser-extension", "api"],
  "exampleRepos": [
    "https://example.com/placeholder-indie-hacker-repo-1",
    "https://example.com/placeholder-indie-hacker-repo-2"
  ],
  "namingRules": {
    "requirePrimaryTech": false,
    "allowBrandingPrefix": true,
    "maxLength": 40,
    "discourageCutesyNames": true
  },
  "descriptionRules": {
    "minLength": 60,
    "maxLength": 160,
    "mustMentionAudience": true,
    "mustMentionPlatform": true,
    "mustMentionValueProp": true
  },
  "readmeRequirements": {
    "requireH1": true,
    "requireWhatWhoPlatformIntro": true,
    "requiredSections": ["What This Is", "Who This Is For", "Quick Start", "Usage"],
    "recommendedSections": ["Pricing", "FAQ", "Changelog"],
    "minWordCount": 400,
    "maxWordCount": 2500
  },
  "topicProfile": {
    "minCount": 5,
    "maxCount": 12,
    "requiredTopics": [],
    "recommendedTopics": ["saas", "startup", "indie-hacker", "developer-tools"]
  },
  "linkingExpectations": {
    "requireDocsLink": true,
    "requireIssueTrackerLink": false,
    "requireHomepageOrDemoLink": true
  },
  "weights": {
    "nameClarity": 1.0,
    "descriptionQuality": 1.3,
    "topicCoverage": 0.9,
    "readmeStructure": 1.2,
    "activityRecency": 0.8,
    "metadataHygiene": 0.8
  }
}

